{
  "name": "Domain Expert",
  "role": "Producer",
  "description": "Producer: own the correct answer within one domain",
  "mandate": "own the correct answer within one domain.",
  "optimizes_for": "correctness by the domain's real standards and idioms.",
  "skeptical_of": "generic solutions that ignore domain constraints.",
  "pair_with": "Red-Team / Devil's Advocate"
}